objectid,filename,youtubeid,vimeoid,title,creator,date,description,subject,location,latitude,longitude,source,identifier,pelicula,produccion,foto,arte,sonido,color,duracion,type,format,language,rights,rightsstatement
coll001,nocheifinalnternacional.jpg,,,universal_internacional,Luis Alberto Restrepo,2003,"Cuenta la historia de una pareja de campesinos que han sido desplazados de su tierra por causa del conflicto armado y han sido lanzados a enfrentar las calles de una ciudad desconocida, enorme y despiadada. Fue filmada en súper 16 mm y posteriormente se amplió a 35 mm para su exhibición comercial.",Centro;Santafe,"Bogotá,Colombia",4.613637563,-74.07141379,Drama,Kr 13 #2645,La primera noche,"Congo Films",Sergio García,Gabriela Monroy,Carlos Eduardo Lopera,Color,94 minutos,Image;StillImage,image/jpeg,es,Public domain,none
coll002,madrefinal.jpg,,,lastetasdemimadre_caracas,Carlos Zapata,2015,"Martín sueña con llevar a su mamá a Disney, por eso trabaja a escondidas como repartidor de pizza. Una noche pide prestado el baño de un burdel donde entrega un domicilio, y por error entra en una cabina de striptease donde ve por primera vez una mujer desnuda. Días después vuelve al sitio para repetir la experiencia, esta vez es su madre la que está detrás del vidrio.",Centro;Santafe,"Bogotá,Colombia",4.603758324,-74.07141379,Drama,Av carácas con Av Jiménez,Las tetas de mi madre,Ernesto Lozano Redondo,Lucas Cristo,Nicolás Duque,Andrés Quintero,Color,81 minutos,Image;StillImage,image/jpeg,es,Public domain,none
coll003,caracolpajarera.jpg,,,estrategiadelcaracol_pajarera,Sergio Cabrera,1993,"Jacinto, un viejo anarquista español en el exilio propone adoptar una especialísima estrategia. El propietario, saborea un primer momento de triunfo. Los inquilinos recurren a una serie de ingeniosos expedientes, transformándose cada uno en su contrario: el ladrón parece honesto, el travestí es el joven romántico, el ilegal dice creer en la ley. Todos con sus propias posibilidades, luchan por el bien común. El final de la confrontación será la victoria de lo imposible y lo insólito",Centro;Candelaria,"Bogotá,Colombia",4.597216202,-74.07754711,Drama;Comedia,Calle9 #8-34,La estrategia del caracol,"""Caracol Televisión, Crear Cine y Video Fotograma""",Carlos Congote,Enrique Linero,Heriberto García,Color,115 minutos,Image;StillImage,image/jpeg,es,Public domain,none
coll004,playadcfinal.jpg,,,Playadc_Centrocomercial,Juan Andres Arango,2012,"La historia de Tomás, un joven afro descendiente que ha huido de la Costa Pacífica colombiana a causa de la guerra, es una fábula que se repite todos los días en el país. Llegar a Bogotá, una metrópolis de ocho millones de habitantes, situada a 2.600 metros sobre el nivel del mar es un punto de quiebre para el personaje, quien debe enfrentarse a una ciudad que poco abre sus puertas. El asfalto, la congestión y la inclemencia de la calle, acompañan el recorrido de Tomás, quien encuentra en el acto de cortar pelo, un arte, un legado histórico de los esclavos que trazaban en los peinados de los niños mapas con rutas de escape. Así, en las cabelleras de los demás, comienza a dibujar el mapa que lo llevará a encontrar a su hermano, y en esta búsqueda, se encontrará a sí mismo.",Centro;Santafe,"Bogotá,Colombia",4.606356025,-74.07470459,Drama,Cl. 18 #10-25,La playa D.C.,Séptima Films,Nicolas Canniccioni,Juna David Bernal,Sonamos Cl,Color,90 minutos,Image;StillImage,image/jpeg,es,Public domain,none
coll005,roafinal.jpg,,,roa_septima_callejon,Andres Baiz,2013,"ROA es una historia ficticia basada en hechos reales sobre Juan Roa Sierra, el presunto asesino del caudillo liberal Jorge Eliécer Gaitán, político y abogado colombiano, candidato disidente del partido Liberal a la Presidencia para las elecciones de 1950, con altas probabilidades de ser electo gracias a un ferviente apoyo popular. La historia sucede en Bogotá en los días previos al 9 de abril de 1948. Roa es un hombre ingenuo y supersticioso, un idealista sin oficio estable pero con una familia que alimentar. Cansado de buscar trabajo y convencido que ha nacido para grandes cosas, visita a su ídolo Gaitán para pedirle trabajo. Sus esperanzas se derrumban cuando Gaitán lo trata con desdén. Su ídolo se convierte entonces en su enemigo, y Roa comienza a armar un ingenuo plan para matarlo. Tras casi ser descubierto, invadido por el miedo, Roa abandona sus ideas locas y endereza su camino. Pero cuando todo parece ir mejorando, el destino le juega una mala pasada: unos misteriosos hombres, que lo han visto vigilando a Gaitán, lo amenazan con matar a su familia si no sigue adelante con su plan criminal. La explosión de ira de la población de la capital, en la que buena parte de la ciudad fue arrasada, se conoce como El Bogotazo, pero las repercusiones del asesinato de Gaitán se extendieron a través de todo el país y llevaron a Colombia a un periodo conocido como La Violencia, que duró casi 10 años y cuyos efectos se siguen sintiendo hasta el día de hoy. Si Juan Roa Sierra actuó solo o realmente fue partícipe de un complot, sigue siendo aún un misterio.",Centro;Candelaria,"Bogotá,Colombia",4.60120289,-74.07424378,Drama,carrera 7a con avenida jiménez,Roa,Dynamo,Guillermo Nieto,Diana Trujillo,César Salazar,Color,90 minutos,Image;StillImage,image/jpeg,es,Public domain,none
coll006,universalmonserrate.jpg,,,universal_monserrate,Felipe Aljure,1991,Comedia negra que transcurre en la selva urbana de Bogotá¸ en donde cada quien tiene que responder por su propia supervivencia¸ en una cadena de deslealtades que¸ en más de un caso¸ terminarán con la muerte. El ex-sargento de Policía Diógenes Hernández es dueño de -La Universal-¸ una precaria agencia de detectives privados¸ que tiene como sede el mismo apartamento en el que conviven él y su esposa Fabiola¸ quien a su vez sostiene un romance con Clemente Fernández¸ sobrino de Diógenes y también trabajador de la agencia. La historia comienza cuando Gastón Arzuaga¸ un mafioso español preso en Colombia¸ contrata a -La Universal- para que vigile a su amante¸ Margarita¸ una actriz de cine porno.,Centro;Candelaria,"Bogotá,Colombia",4.6005449506, -74.07087420233,Comedia,Av. Jimenez #4-49,La gente de la universal,"""Foto club 76, IMS""",Gonzalo Fernández Berrid,Charlotte Haeger,"""Valentín Kirilov, Heriberto García, Lina Uribe""",Color,126 minutos,Image;StillImage,image/jpeg,es,Public domain,none
coll007,universalmuseo.jpg,,,universal_museo_nacional,Felipe Aljure,1991,Comedia negra que transcurre en la selva urbana de Bogotá¸ en donde cada quien tiene que responder por su propia supervivencia¸ en una cadena de deslealtades que¸ en más de un caso¸ terminarán con la muerte. El ex-sargento de Policía Diógenes Hernández es dueño de -La Universal-¸ una precaria agencia de detectives privados¸ que tiene como sede el mismo apartamento en el que conviven él y su esposa Fabiola¸ quien a su vez sostiene un romance con Clemente Fernández¸ sobrino de Diógenes y también trabajador de la agencia. La historia comienza cuando Gastón Arzuaga¸ un mafioso español preso en Colombia¸ contrata a -La Universal- para que vigile a su amante¸ Margarita¸ una actriz de cine porno.,Centro;Candelaria,"Bogotá,Colombia",4.615617362076, -74.06867797289,Comedia,Cra. 7 #N. 28-66,La gente de la universal,"""Foto club 76, IMS""",Gonzalo Fernández Berrid,Charlotte Haeger,"""Valentín Kirilov, Heriberto García, Lina Uribe""",Color,126 minutos,Image;StillImage,image/jpeg,es,Public domain,none
coll008,universalsuitestequendama.jpg,,,universal_suites_tequendama,Felipe Aljure,1991,Comedia negra que transcurre en la selva urbana de Bogotá¸ en donde cada quien tiene que responder por su propia supervivencia¸ en una cadena de deslealtades que¸ en más de un caso¸ terminarán con la muerte. El ex-sargento de Policía Diógenes Hernández es dueño de -La Universal-¸ una precaria agencia de detectives privados¸ que tiene como sede el mismo apartamento en el que conviven él y su esposa Fabiola¸ quien a su vez sostiene un romance con Clemente Fernández¸ sobrino de Diógenes y también trabajador de la agencia. La historia comienza cuando Gastón Arzuaga¸ un mafioso español preso en Colombia¸ contrata a -La Universal- para que vigile a su amante¸ Margarita¸ una actriz de cine porno.,Centro;Candelaria,"Bogotá,Colombia",4.6143596554601,-74.0704666258,Comedia,Cra. 10 #27-51,La gente de la universal,"""Foto club 76, IMS""",Gonzalo Fernández Berrid,Charlotte Haeger,"""Valentín Kirilov, Heriberto García, Lina Uribe""",Color,126 minutos,Image;StillImage,image/jpeg,es,Public domain,none
coll010,alguienlasnieves.jpg,,,alguien_iglesia_lasnieves,Jorge Navas,1999,"Heriberta, pequeña y hermosa niña, es hija de una madre de ortodoxa religiosidad y de un médico ya muerto, de quien heredó un libro de anatomía y un fino bisturí. Su madre cree que la niña va a ser médico como su padre, pero ella lo que quiere es ser vampiro. Heriberta le teme a crecer, a envejecer, a ser como su madre o a morir como su progenitor. Lee en un libro la historia de una princesa antigua que guardaba su juventud y belleza gracias a la sangre de sus súbditos. Entiende entonces cuál puede ser la cura para su mal. Tiene su libro de anatomía, su bisturí y su infantil placer por el sabor de las gotitas de sangre. Pero la sangre es cochina, dice su madre y Dios todo lo ve y todo lo castiga.",Centro;Candelaria,"Bogotá,Colombia",4.606189949759,-74.07116569731,Thriller;Drama,"Cl. 20, La Candelaria",Alguien mató algo,"""Cinemateca Distrital, Laberinto Producciones, Ojo Tachado""",Juan Carlos Gil,Jaime Luna,César Salazar,Blanco/negro,27 minutos,Image;StillImage,image/jpeg,es,Public domain,none
coll011,alguienbartolome.jpg,,,alguien_colegio_sanbartolome,Jorge Navas,1999,"Heriberta, pequeña y hermosa niña, es hija de una madre de ortodoxa religiosidad y de un médico ya muerto, de quien heredó un libro de anatomía y un fino bisturí. Su madre cree que la niña va a ser médico como su padre, pero ella lo que quiere es ser vampiro. Heriberta le teme a crecer, a envejecer, a ser como su madre o a morir como su progenitor. Lee en un libro la historia de una princesa antigua que guardaba su juventud y belleza gracias a la sangre de sus súbditos. Entiende entonces cuál puede ser la cura para su mal. Tiene su libro de anatomía, su bisturí y su infantil placer por el sabor de las gotitas de sangre. Pero la sangre es cochina, dice su madre y Dios todo lo ve y todo lo castiga.",Centro;Candelaria,"Bogotá,Colombia",4.597074553816,-74.07577917621,Thriller;Drama,Cra. 7 #9-96,Alguien mató algo,"""Cinemateca Distrital, Laberinto Producciones, Ojo Tachado""",Juan Carlos Gil,Jaime Luna,César Salazar,Blanco/negro,27 minutos,Image;StillImage,image/jpeg,es,Public domain,none
coll012,alguienpasaje.jpg,,,alguien_pasaje_hernandez,Jorge Navas,1999,"Heriberta, pequeña y hermosa niña, es hija de una madre de ortodoxa religiosidad y de un médico ya muerto, de quien heredó un libro de anatomía y un fino bisturí. Su madre cree que la niña va a ser médico como su padre, pero ella lo que quiere es ser vampiro. Heriberta le teme a crecer, a envejecer, a ser como su madre o a morir como su progenitor. Lee en un libro la historia de una princesa antigua que guardaba su juventud y belleza gracias a la sangre de sus súbditos. Entiende entonces cuál puede ser la cura para su mal. Tiene su libro de anatomía, su bisturí y su infantil placer por el sabor de las gotitas de sangre. Pero la sangre es cochina, dice su madre y Dios todo lo ve y todo lo castiga.",Centro;Candelaria,"Bogotá,Colombia",4.60066602010,-74.07582862717,Thriller;Drama,Cra 8a #12a-72,Alguien mató algo,"""Cinemateca Distrital, Laberinto Producciones, Ojo Tachado""",Juan Carlos Gil,Jaime Luna,César Salazar,Blanco/negro,27 minutos,Image;StillImage,image/jpeg,es,Public domain,none
coll013,diastolechorro.jpg,,,diastole_chorrode_quevedo,Harold Trompetero,2000,Basada en una serie de episodios encaminados¸ como lo asegura su director¸ a exorcizar las taras¸ temores y fobias que circulan sobre el universo del amor común y corriente. Son 35 historias desarrolladas en un promedio de dos minutos las que estructuran este largometraje¸ una tentativa de explicar el fracaso matrimonial a la manera de un rompecabezas que se organiza en el transcurso de la trama.,Centro;Candelaria,"Bogotá,Colombia",4.59719752170,-74.06972617560,Drama;Comedia,Cl. 12b #22 2-98,Diástole y sístole,Comunicarte Producciones,Rafael Orjuela,"""Rafael Orjuela; Jaime Correa""",César Salazar,Color,80 minutos,Image;StillImage,image/jpeg,es,Public domain,none
coll014,diastole93.jpg,,,diastole_parque_93,Harold Trompetero,2000,Basada en una serie de episodios encaminados¸ como lo asegura su director¸ a exorcizar las taras¸ temores y fobias que circulan sobre el universo del amor común y corriente. Son 35 historias desarrolladas en un promedio de dos minutos las que estructuran este largometraje¸ una tentativa de explicar el fracaso matrimonial a la manera de un rompecabezas que se organiza en el transcurso de la trama.,Centro;Candelaria,"Bogotá,Colombia",4.67626606109, -74.0476129687,Drama;Comedia,Cra. 11a #93A - 22,Diástole y sístole,Comunicarte Producciones,Rafael Orjuela,"""Rafael Orjuela; Jaime Correa""",César Salazar,Color,80 minutos,Image;StillImage,image/jpeg,es,Public domain,none
coll015,diastoleembudo.jpg,,,diastole_calle_embudo,Harold Trompetero,2000,Basada en una serie de episodios encaminados¸ como lo asegura su director¸ a exorcizar las taras¸ temores y fobias que circulan sobre el universo del amor común y corriente. Son 35 historias desarrolladas en un promedio de dos minutos las que estructuran este largometraje¸ una tentativa de explicar el fracaso matrimonial a la manera de un rompecabezas que se organiza en el transcurso de la trama.,Centro;Candelaria,"Bogotá,Colombia",4.59776532005,-74.06965254593,Drama;Comedia,Calle del embudo,Diástole y sístole,Comunicarte Producciones,Rafael Orjuela,"""Rafael Orjuela; Jaime Correa""",César Salazar,Color,80 minutos,Image;StillImage,image/jpeg,es,Public domain,none
coll016,eldramadel15deoctubre.png,,,dramadel15deoctubre_estatua,Vincenzo Di Domenico,1915,"Considerado el primer largometraje documental producido en Colombia, muestra los acontecimientos que rodearon el asesinato del general Rafael Uribe Uribe el 15 de octubre de 1914, incluida una reconstrucción del asesinato en sí.",Centro;Losmartires,"Bogotá,Colombia",4.616395698,-74.07488578,Documental,Cra 20 #3780,El drama del 15 de octubre,Hermanos Di Domenico,sin información,sin información,sin información,Blanco/negro,sin información,Image;StillImage,image/jpeg,es,Public domain,none
coll017,monserratecura.png,,,monserrate_cura,Jorge Silva y Carlos Mayolo,1971,"Visión crítica y mordaz sobre el fanatismo religioso turístico de los peregrinos al Santuario de Monserrate en la ciudad de Bogotá. Primer encuentro con un estilo de confrontación de la imagen y el sonido de una manera contradictoria, corrosiva y humorística. Siete minutos de distorsiones y una realidad vacía. ",Centro;Santafe,"Bogotá,Colombia",4.605342493,-74.05553686,Documental,Cra 2da este n° 21-48,Monserrate,Corafilm.,Victor Morales,sin información,Jorge Silva y Yezid Guerrero,Blanco/negro,8 minutos,Image;StillImage,image/jpeg,es,Public domain,none
coll018,monserrateescaleras.png,,,monserrate_escaleras,Jorge Silva y Carlos Mayolo,1971,"Visión crítica y mordaz sobre el fanatismo religioso turístico de los peregrinos al Santuario de Monserrate en la ciudad de Bogotá. Primer encuentro con un estilo de confrontación de la imagen y el sonido de una manera contradictoria, corrosiva y humorística. Siete minutos de distorsiones y una realidad vacía. ",Centro;Santafe,"Bogotá,Colombia",4.605342493,-74.05553686,Documental,Cra 2da este n° 21-48,Monserrate,Corafilm.,Victor Morales,sin información,Jorge Silva y Yezid Guerrero,Blanco/negro,8 minutos,Image;StillImage,image/jpeg,es,Public domain,none
coll019,chircales.png,,,chircales,Marta Rodriguez,1972,"Chircales es la búsqueda de una metodología adaptada a las condiciones socio-políticas de América Latina. Su filmación se inicia en el año 1966 al sur de la ciudad de Bogotá en un barrio llamado Tunjuelito, donde existían grandes haciendas cuyos dueños arrendaban sus tierras para la producción artesanal de ladrillos. En este documental aplicamos como marco metodológico la ""observación participante"", método de trabajo que supone que el cineasta se integre a la comunidad, sea aceptado por ella y se convierta en un miembro más de la familia elegida para realizar el documental. Desde este punto, los realizadores de Chircales compartieron 5 años la vida de la familia Castañeda, fabricantes de ladrillos. Durante estos 5 años de realización aportamos una metodología para el cine documental en condiciones de violencia política. En los años 60 y 70 no existían en Colombia escuelas de cine, ni casas productoras de documentales, las únicas herramientas que poseíamos eran una cámara y una grabadora con las que se logró mostrar la poesía, la violencia y la explotación de la familia Castañeda.",Sur;Tunjuelito,"Bogotá,Colombia",4.54757714,-74.13071685,Documental,sin información,Chircales,Jorge Silva,Jorge Silva,sin información,"Pierre Jacopin, Marta Rodriguez",Blanco/negro,42 minutos,Image;StillImage,image/jpeg,es,Public domain,none
coll020,larebeca.png,,,agarrando_pueblo,Carlos Mayolo y Luis Ospina,1977,Película de ficción que simula ser un documental sobre los cineastas que explotan la miseria con fines mercantilistas. Es una crítica mordaz a la “porno-miseria” y al oportunismo de los documentalistas deshonestos que hacen “documentales socio-políticos” en el Tercer Mundo con el objeto de venderlos en Europa y ganar premios.,Centro;Santafe,"Bogotá,Colombia",4.612212028777,-74.07146909629,Ficcion,Calle 25 entre carreras 12 y 13,Agarrando Pueblo ,"Carlos Mayolo, Luis Ospina SATUPLE","Enrique Forero, Oswaldo Lopez, Eduardo Carvajal, Jacques Marchal",sin información,Luis Ospina,Color,28 minutos,Image;StillImage,image/jpeg,es,Public domain,none
coll021,defensaajedrez.jpg,,,defensadeldragon_ajedrez,Natalia Santa,2017,"Samuel, Joaquín y Marcos son tres viejos amigos que pasan sus días en el centro de Bogotá, entre el legendario club de ajedrez Lasker, el Casino Caribe, y el tradicional café La Normanda. Samuel (53) es un ajedrecista profesional que vive de apostar en pequeñas partidas que sabe ganadas. Su mejor amigo es Joaquín (65), un consagrado relojero que está a punto de perder el taller que heredó de su padre. Y después está Marcos (72), un homeópata español que se dedica a buscar la fórmula para ganar en el póquer. Estos tres hombres se han refugiado en la seguridad de sus rutinas para no tener que asumir sus derrotas esenciales. Pero llega un momento en que la realidad los confronta y los hace tambalear. Entonces tendrán que tomar decisiones que ponen en riesgo esa seguridad, decisiones aparentemente pequeñas pero que los obligarán a replantear su lugar en el mundo. Mientras Samuel entrena a un pupilo para el campeonato local de ajedrez, Joaquín intenta mantener a flote su taller, y Marcos averigua por qué su hijo no le ha vuelto a mandar su pensión, distintos sucesos afectarán la cotidianidad de estos hombres, y entenderán que, en la vida como en el amor, nunca es tarde para arriesgarse a perder. ",Centro;Santafe,"Bogotá,Colombia",4.60798069607,-74.0706124134,Drama,"Cra. 7 #21-81, Bogotá",La defensa del dragón,Galaxia 311,Iván Herrera & Nicolás Ordóñez,Marcela Gómez,Juanma López,Color,80 minutos,Image;StillImage,image/jpeg,es,Public domain,none
coll022,cartuchoparque.jpg,,,cartucho_parque,Andrés Chaves,2017,"No tiene precedentes en la historia colombiana que un magnífico barrio colonial, formado por familias y negocios tradicionales, se convirtiera en el hogar de miles de indigentes y mafias. Sus calles y antiguas casonas se convirtieron en fumaderos de bazuco. Este es un documental que reconstruye la memoria rota del barrio El Cartucho en Bogotá. Es una historia de degradación que representa una sociedad que trata de barrer la basura debajo del tapete. Después de su violenta demolición en 2001 el gobierno construyó un parque estéril que la gente teme. Pero el legado del Cartucho se mantiene en la cercanía. Destruimos el barrio, pero la rabia se mantiene.",Centro;Santafe,"Bogotá,Colombia",4.59775799300,-74.0809229484,Drama,"Cra. 10 #9-30, Bogotá",Cartucho,Andrés Chaves,Daniel Galán,sin información,sin información,Color,55 minutos,Image;StillImage,image/jpeg,es,Public domain,none
coll023,untalalonsotransmilenio.jpg,,,untalalfonso_transmilenio,Libia Stella Gómez,2020,"Para Alonso Quijano, profesor de literatura y experto en Don Quijote de la Mancha, la delgada línea entre la cordura y la locura se rompe un día y, a partir de ese momento, su cómplice, el asistente veterinario Santos Carrasco, recorre el pasado del profesor para descubrir que su locura no es más que un escape del dolor y el refugio definitivo que se encuentra en la fantasía.",Occidente;Teusaquillo,"Bogotá,Colombia",4.63660745106,-74.0826287888,Drama,Calle 26 con Cra. 40,Un tal Alfonso Quijano,Red Collision Entertainment,Diego Gama Romero,Alirio Cruz Cabrera,Julián Camilo Sánchez,Color,102 minutos,Image;StillImage,image/jpeg,es,Public domain,none
coll024,memoriaestatua.jpg,,,memoria_estatua,Apichatpong Weerasethakul,2021,"Jessica (Tilda Swinton) no puede dormir desde que un fuerte ""bang"" interrumpió su sueño al amanecer. Mientras visita a su hermana en Bogotá, se hace amiga de Agnes (Jeanne Balibar), una arqueóloga que estudia restos humanos descubiertos dentro de un túnel en construcción. Jessica viaja para encontrarse con Agnes en el lugar de excavación y, en un pueblo cercano, conoce a un pescador llamado Hernán (Elkin Díaz). Ambos comparten recuerdos junto al río y cuando el día llega a su fin, Jessica se despierta con una sensación de claridad.",Centro;Santafe,"Bogotá,Colombia",4.6119635,-74.067760,Drama,"Cl. 24 #6a-1, Bogotá",Memoria,Burning,Sayombhu Mukdeeprom,Angélica Perea,Raúl Locatelli,Color,136 minutos,Image;StillImage,image/jpeg,es,Public domain,none
coll025,unvaroncalle.jpg,,,unvaron_calle,Fabián Hernández,2023,"Carlos vive en un hogar para jóvenes en el centro de Bogotá, una especie de refugio donde se mitiga la dureza y los sinsabores de la vida. Carlos anhela pasar la navidad junto a su madre y hermana, inmersas en los círculos de violencia urbana. Al salir del internado, Carlos se confronta con el rigor de las calles de su barrio, donde impera la ley del más fuerte, del más macho. El deberá elegir entre seguir estos códigos de masculinidad o confiar en su naturaleza profunda.",Centro;Losmartires,"Bogotá,Colombia",4.60024142620,-74.0843042158,Drama,Calle 8 con Cra. 15A,Un Varón,Medio de Contención Producciones,Sofía Oggioni,Juan David Bernal,Isabel Torres,Color,82 minutos,Image;StillImage,image/jpeg,es,Public domain,none
coll026,paloquemaotorre.jpg,,,paloquemao_torre,Jeferson Cardoza Herrera,2023,"Pedro es uno de los vampiros del subdesarrollo que trabaja en medio de pasillos llenos de ajos, frutas, hierbas y crucifijos de la Plaza de Mercado Paloquemao. Sin embargo, el 28 de mayo de 2016, cuando la mayor red de tráfico de sangre de Bogotá es desmantelada, su dealer Harbey escapa y se refugia en la plaza, amenazando su relación con Angie, la chica de la que está enamorado.",Centro;Losmartires,"Bogotá,Colombia",4.615908363,-74.08406211,Terror,Av. Cdad. de Lima #25-04,Paloquemao,Melisa Zapata Montoya,Santiago M. Cortés,Ricardo Téllez,Santiago Rodríguez,Blanco/negro,20 minutos,Image;StillImage,image/jpeg,es,Public domain,none
coll027,sanandresito.jpg,,,sanandresito_fachada,Alessandro Angulo,2012,"En Sanandresito, el renombrado sector de bodegas de mercancía de Bogotá se encuentra cualquier cosa: desde zapatos de moda o perfumes costosos, hasta celulares, licor de todos los estratos y películas. ¡Todo lo que busque, se le tiene! De esto podrá dar fe Wilson Tenorio, un espontáneo agente de policía que se mueve como pez en el agua en este lugar. Wilson anhela un ascenso en su institución pero no está dispuesto a mover un solo dedo para lograrlo. Las cosas cambiarán cuando se ve falsamente enredado en el asesinato de una muchacha de Sanandresito cuyo cadáver aparece en la camioneta oficial que él conduce. Sin más ingenio que su propia malicia indígena, el agente Tenorio deberá descubrir al verdadero asesino, antes de que lo capture la policía, a cargo de su propia novia, la Sargento Fanny; y antes de que Félix, un peligroso escolta ciego por el dolor, lo encuentre y erróneamente cobre venganza sobre él",Centro;Puentearanda,"Bogotá,Colombia",4.6156913987,-74.1035513,Acción;Comedia,carrera 38 #8-61,Sanandresito,Laberinto cine y televisión,Alfredo Ruiz,German Lizarralde,sin información,Color,90 minutos,Image;StillImage,image/jpeg,es,Public domain,none
